Matteo non arrabbiarti, Matteo non arrabbiarti.....Buona serata da Strasburgo amici.
#Primagliitaliani!Pappa col pomodoro e ribollita, viva la #Toscana in tavola!!!Autogrill, non piove più, direzione festa Lega al palasport di Scandicci (Firenze).
Aspetto voi, non Renzi!
E sulle quattro pere prese dal #Milan, no comment...Felice di aver conosciuto don Michele Sozzani, cappellano del Policlinico San Matteo di Pavia, uomo con le idee chiare su immigrazione, accoglienza, ius soli, legalità, rispetto e carità cristiana.
Buona domenica Amici, buona domenica con Michele!Cielo grigio e #pioggia su #milano, purtroppo sei morti per il #maltempo a #livorno.
Come va da voi?Voglia di #Ruspa!Acciughe con prezzemolo e aglio, pomodorini ripieni al tonno, specialità di #Calabria. Buon appetito Amici!#buonaserata Amici, si gioca!Ieri sera, inaugurazione della sede Lega di Angera (Varese) insieme a 300 persone. Andiamo a governare!Pieno di gente con la Lega anche ieri sera a Paderno (Milano)! Buon venerdì, Amici!#buonanotte Amici!Che cielo! Da voi com'è?Splendido!Oggi a Milanistan.
Ma vi sembra normale???E vai con la Fidighina, salame piemontese!#ForzaFerrari!Qui #Monza, forza #Ferrari! #GP #MonzaGP#Buonadomenica Amici!
Non vedo l'ora di andare a governare per ridare lavoro, futuro, ordine e speranza agli #italiani.
Mi date una mano?Buona notte dal #lagoCon Alberto Cova, uno dei più grandi campioni italiani di atletica di sempre!Arrivederci montagne, si torna a lottare!
Ma che #caldo fa da voi???Aria pulita. E zero clandestini. Farò di tutto perché sia così in tutta Italia!Madonnina dai riccioli d'oro con la #fisarmonica. 
Spettacolo a #Pinzolo!Che belle!!!Pomodori dell'orto, origano, cipolla di Tropea e peperoncino.
Poca spesa, gran sapore!
#mangiamoitalianoDomenica in buona compagnia.Quando i nostri nonni lottavano, e morivano, per proteggere i nostri confini e la nostra gente.
Una preghiera e l'impegno di non dimenticare.Dedicati a voi! #buonadomenica Amici.Nonostante l'acqua, tantissima gente con la Lega a Pinzolo, in Trentino. #andiamoagovernareIn attesa di grigliare Renzi... Giornata con amici!Polenta, salamela e formaggio fuso.
La dieta prosegue.....Ma quelli che su #instagram vengono a insultare anche sulle foto dei nani, della polenta, dei giochi per bimbi e delle gite in montagna, che #sfigati sono?!?Non so voi, io adoro i nani da giardino!Risotto coi funghi, pizzoccheri e finferli.
Solo buone cose italiane!Cacchio, manca la #RUSPA!Gente di montagna, gente vera alla #baitaMotin sopra #Bormio. Un abbraccio a tutti voi Amici!Sul passo del Foscagno in alta #valtellina con i colori della Cancro Primo Aiuto Onlus.Ma quanto è buona la crosta della polenta abbrustolita??? Saluti dalla verdissima #Livigno al #ristoroValAlpisellaOggi la #pesca in #valtellina in un lago sopra a #bormio è andata bene! E stasera speriamo nel #Milan!Porcini spettacolari alla #baitaMotin in #valtellina!Un fiore per ogni vittima innocente.
Ma i fiori non bastano più.
Controlli, espulsioni, ordine, regole e rispetto!Oggi ho beccato lo sciopero delle trote...Cin cin a tutti voi! Non alla Boldrini.La #briscola di #ferragosto a #pontedilegno. Buon pomeriggio Amici!Vacca con vista Dolomiti del Brenta.
Buongustaia!Torta di mele, carote, pere e cioccolato.
Buona domenica dietetica Amici!Un saluto dallo splendido lago di Garda!
Purtroppo non c'è Renzi...
P.s. Sulla fronte il risultato di un incontro ravvicinato, troppo ravvicinato, con lo stipite di una finestra.Splendido #Garda! E voi dove siete?Dedicato a chi viene su questa Pagina a insultare!
D'Annunzio, genio assoluto.
Buon sabato Amici, vi voglio bene!Sentite che cosa dicono Andrea Orlando e Andrea Romano, entrambi del PD.
Il primo, ministro della Giustizia, dice che la Lega vuole lasciare ANNEGARE le persone in mare!
Il secondo, deputato, sostiene che voglio affondare le navi delle Ong con la gente A BORDO!
VERGOGNOSI E BUGIARDI.
Che dite, quereliamo???Pazzesco. Ecco altre foto della #tempesta di poco fa a #Jesolo.Oh oh... Tempesta in arrivo...
Com'è il tempo da voi?Ciclisti per #Jesolo!#Burano, i #colori delle #case dei #pescatori.Lo spettacolo dei colori delle case dei pescatori di #Burano, patria del merletto.
Abbiamo il territorio più bello del mondo, difendiamolo!#maurocorona e la sua #montagna. Numero Uno!Secondo quel poveretto (di spirito, non di conto corrente) di Saviano io sono (quindi voi siete) razzista, ignorante, farneticante, sgrammaticato...
Se andiamo al governo, dopo aver bloccato l'invasione, gli leviamo anche l'inutile scorta. Che dite? 
GUARDA IL VIDEO INTEGRALE SULLA MIA PAGINA FACEBOOK > https://www.facebook.com/salviniofficial/videos/10155038332623155/Mi sto allenando per proteggere i confini, salvare qualunque naufrago ma riportando TUTTI INDIETRO!Formaggini Susanna, che nostalgia...
Ve li ricordate?Omaggio ai 2.000 morti del #Vajont, fra cui 500 bambini, vittime della follia umana e della fame di denaro.
Mai più.Spettacolari incontri pieni di bella gente anche oggi a Lazzate, in Brianza, e a Lomazzo (Como), nonostante il sabato di caldo africano! Siamo sulla strada giusta, se mi aiuterete a ridare fiducia a quegli italiani che la hanno perduta, riportandoli a votare, il Pd in questo Paese avrà un futuro solo come partito di opposizione!Con questo freschino, un bel piatto di trippa...
Buon sabato Amici!Tanto caldo e tantissima gente che ha voglia di #cambiare con la #Lega a Borgo San Giacomo (Brescia).
#Renzi stiamo arrivando!😃Ma che caldo fa oggi a Milano?!?
Da voi come si sta?#Donazione di #sangue, fatta.
Un gesto che non costa niente, e che salva una vita.
Grazie a #AvisMilano, se state bene donate anche voi!Folla incredibile, nonostante un caldo africano, per sostenere le battaglie della Lega stasera a Pontida (Bergamo).
Napolitano, Boldrini, Renzi e Alfano: preparate le valigie!Bentornato in Europa #Milan!Spettacolare "tavola da pranzo" in legno per il cagnolino del Fede, regalata da un'amica leghista: grazie!Spettacolare pienone con la Lega ad Arcore!
E come mi ha detto stamattina un signore di Prato (che votava Pd!) "Renzi mi ha rotto i c......i, vi voto ma fare in fretta a vincere"!
#renziacasa e andiamo a governare.
Vi voglio bene!Quanto mi piacciono i fichi!
Incontro ora un signore che mi dice "Sono di Prato, ho votato Renzi ma mi ha rotto i c......i, ora il voto sarà tuo".
E la giornata sorride! #renziacasaCon Bruno e la sua #pizza originale! Tornerò a trovarlo alla Pizzeria Elisir di #Massa.Oltre 1.200 persone con me stasera alla #Versiliana per ascoltare le nostre idee sul futuro dell'Italia. Altro che #matteorenzi, andiamo a governare e cambiamo tutto!Buongiorno Amici, vi aspetto domani alle 18.30 in Versiliana a Marina di Pietrasanta per un dibattito sul futuro dell'Italia.
Chi non viene è un #matteorenzi.
P.s. Per ora al largo non si vedono barconi...Merenda romagnola! Vi voglio bene Amici.Oggi pollo, arrosticini e un po' di fritto.
#buonadomenica Amici!Ragazzo con le idee chiare a Cervia!Un mare di gente con la Lega a Fontevivo (Parma).
Dai, a casa il PD e andiamo a governare!Vabbè, continuo la dieta...Fra poco serata #Milan.
Sono curioso: pronostici?Numero uno!Biscotti con ruspa.
Anche se la RUSPA non vedo l'ora di usarla per altro...Con la signora Milly che sta preparando la #pastafresca. Viva il Made in Italy!#buonanotte in freschezza Amici, vi voglio bene!Comprare italiano e lottare contro gli abusivi.
Volere è potere! #stopinvasione
Vi aspetto sabato alle 20 alla festa Lega di Cervia!Il mio campione del #minigolf.
Io non ci provo neanche...Mascarpone... Adoro. Che faccio, vado?Polizia locale, controlli e sequestri, e i vù cumprà in spiaggia a disturbare non ci sono più.
Volere è potere!
Dalle vostre parti com'è?
Vi aspetto alla Festa Lega di CERVIA sabato 29 LUGLIO.
#andiamoagovernare #stopinvasioneVabbè... Spettacolo di #piadina romagnola!
#buonsabato sera!#briscola impegnativa a #MilanoMarittima al #Papeete
Buon sabato Amici!Non ho mai vinto un solo pallone in #salagiochi...Ora mi leggo un bel libro (su Gabriele e la sua famiglia, in lotta con il fantasma dell'autismo) e alle 18 risponderò alle vostre domande in diretta sulla mia pagina Facebook.
Buon pomeriggio Amici.Oggi la giornata comincia bene.
Guardate che maglietta spettacolare mi ha fatto mio figlio!Ma quanto saltella il #cane Balù? Le peggiori sciagure a chi abbandona il suo amico a quattro zampe!GRAZIE ai Vigili del Fuoco di tutta Italia, che anche in questi giorni lottano per salvare vite e spegnere incendi.
E il Governo si impegni ad assumere personale e aumentare le risorse a loro disposizione, noi ci stiamo!Perché quando ero bambino io non esistevano i #gonfiabili??? Vabbè, con #200lire si comprava un gelato...Stasera il Salvini si dedica alla #pizza!Con #LucaZaia e Bruno Vianello, patron della #Texa di Monastier (Treviso) che dà lavoro a 600 persone e non si è mai arreso vendendo a proprietà straniere.Spiaggia Punta Canna di Chioggia: come dargli torto?!? #primagliitaliani #ciaoboldrini #andiamoagovernare #puntacanna #stopinvasioneBuongiorno Amici!
Dopo Piemonte e Lombardia, Emilia e Toscana, Calabria e Lazio, oggi sveglia presto direzione Veneto, per incontrare cittadini, agricoltori, imprenditori e... bagnini!
#andiamoagovernare #stopinvasioneFocaccia alla cipolla di Recco e #quartogrado sulla condanna di Bossetti. Sarò normale..??Anche Tropea in Calabria vuole cambiare: #bastaPd!Con lo staff dello splendido ristorante #ilNormanno di #Tropea. Ma dove lo mangi un #pescespada così???Ma quanto è bello il #mare della #Calabria? L'Italia potrebbe vivere di turismo, se solo la politica fosse più onesta e concreta.Scuola di Polizia di Vibo Valentia, nessuno pensi di chiudere una realtà efficiente come questa!In tantissimi all'inaugurazione della sede leghista di Vibo Valentia! Da Nord a Sud, #stopinvasione!Un piatto leggero, povero ed estivo: polenta, carne e formaggio fuso! #nientedieta #buonadomenicaIn diretta da Piacenza seguite anche voi LIVE sulla mia pagina Facebook le nostre proposte per costruire il Futuro!
#facciamosquadra #andiamoagovernareSpettacolo il #lagodiComo!Non so voi, ma io adoro le #fragolinedibosco! Che fate di bello in questo caldo #sabato di luglio?Centinaia di persone stasera con la Lega a Fubine (Alessandria).
Ciao ciao Renzi.Ma quanto è bella questa bimba? Complimenti a mamma e papà, incontrati ieri sera a una festa #Lega. Avanti futuro!Arancini siciliani a mezzanotte, dietetici...Cappelletti col ragù. Vado???Vi salutiamo da Novafeltria, Valmarecchia, tanta bella gente con la Lega in Romagna! E voi che fate, Amici?Splendido #tramonto sull'Appennino di #Romagna, dedicato a voi!Todi finalmente libera dalla sinistra: missione compiuta!E poi arrivi a #Todi nella splendida #Umbria e ti si apre il cuore!Ecco la splendida squadra di donne e uomini della Lega che da domani, e per la prima volta nella storia, amministrerà il Comune di Genova.
Buon lavoro, dalle parole bisogna passare ai fatti!
#bastapd #genovaliberaMiracoli della natura, senza acqua e senza cura, tre pomodorini non mollano e crescono!
Buona domenica Amici.Spettacolo!
Non serve il tanto, o il troppo, per apprezzare la vita.
Buona serata Amici, vi abbraccio.Coi volontari della Croce Verde, grazie per quello che fate!!!No comment! Loro chiacchierano e se ne vergognano, noi non vediamo l'ora di farlo veramente!
#andiamoagovernare #Renzi #SalviniVi siete alzati incazzati? Forse anch'io...
Ma non ne vale la pena, i giorni sono troppo brevi per regalarli alla rabbia!
Buon venerdì Amici.Dedicato a voi, Amiche di questa splendida Comunità!PAZZESCO, FAI GIRARE!
La candida confessione di Emma Bonino, già ministro degli esteri nel governo PD: "Che gli sbarchi avvenissero TUTTI IN ITALIA l'abbiamo chiesto NOI!". CAPITO???
VERGOGNATEVI! Non vedo l'ora di mandarli a casa, STANNO ROVINANDO l'Italia!
#BASTAPD #STOPINVASIONE#Plenaria #Strasbourg #StrasburgoI cittadini europei vi pagano per dare loro LAVORO e SICUREZZA, non per fare regali a SCAFISTI e BANCHIERI!
P.s. Fate girare in rete il video integrale che ho postato sulla mia pagina Facebook, perché i tigì come sempre taceranno.Notte serena a chi non si arrende!
"Se puoi sognarlo, puoi farlo" (Walt Disney).Strapieno ieri sera con la Lega a Domodossola: buona politica e buona amministrazione con i nostri sindaci!Buon viaggio immenso Paolo #Villaggio!
Altro che "cinema minore", eri un Numero Uno.
Sempre viva la Pina, la Coppa Cobram e il pesce ratto.Pane e salame, secondo voi posso lanciarmi o rischio di offendere qualcuno politicamente corretto?Giovedì sera, #ModenaPark, bellissimo!Immenso, emozionante, spettacolare #Vasco. #modenaparkLavoro, immigrazione, agricoltura, riforma di scuola e giustizia, federalismo, riforma fiscale e aiuto ai disabili. Questo e altro stasera alle 23.15 da Vespa su Rai Uno. Ci siete???Dopo 70 anni Sesto San Giovanni ha scelto il coraggio! #nomoschea #stopinvasioneTrofie al pesto per festeggiare la vittoria di Genova!
Ma tanto Renzi dice che ha vinto lui.....
#ricoveratelo #andiamoagovernareGenova festeggia la liberazione!Acciughe, pesce povero ma buonissimo!!!
Buona serata Amici, che fate stasera?Principessa!Questa domenica tocca a VOI!
Invia a 5 amici! Se si vince, Gentiloni, Renzi, Boschi e Boldrini piangono!
#iovoto #bastaPD #primagliitalianiSorrisi da Genova, vi vogliamo bene!
Amici genovesi, se volete mandare a casa il Pd, in città e in Italia, domenica tutti a votare per Marco #Buccisindaco!A Crema per dire NO alla Grande Moscha che il PD vorrebbe costruire nell'area verde agricola che vedete alle nostre spalle.
#stopinvasione #questadomenica #25giugnoBuon venerdì Amici, fa già caldo...
Ora in diretta su Rai Tre, poi incontri coi cittadini in tre mercati di Verona.
P.s. Un bravo al mio ragazzo che ha finito l'esame di terza media!
Voi che fate?Un po' di scatti dalle tappe di oggi, da Meda a Monza, da Legnano a Tradate, fino a Palazzolo sull'Oglio, in giro per la mia bella Lombardia. 
Nonostante il caldo estivo, è per me sempre stupendo incontrare e sostenere persone oneste e competenti che vogliono mettersi al servizio delle proprie Comunità.
Domenica tocca a voi!
#iovoto #bastaPD #cambiaresipuòPronto per rispondere in diretta ai lettori di Repubblica.it, questo è l'ingresso della redazione......Buon giovedì Amici!
Fra poco risponderò in diretta alle domande dei cittadini su Telelombardia (02 320046240) e a seguire sarò a Meda, Monza, Legnano, Tradate, Palazzolo sull'Oglio e Verona.
#iononmifermo #stopinvasioneIl 21 giugno dell'anno scorso spegnevo l'ultima sigaretta, impegno mantenuto: da 365 giorni NON FUMO PIÙ!!!Chi finanzia la moschea di Sesto San Giovanni, vicino Milano? Se c'è dietro un Paese estremista come il Qatar, a mio modo di vedere non si apre neanche mezzo metro quadro di sottoscala.Grazie ragazzi per tutto quello che fate. Lega sempre dalla parte della nostra Polizia!Buon martedì Amici, si vola a Bruxelles per difendere il Made in Italy, imprese, lavoratori e artigiani italiani dimenticati dal governo.Quanta gente in piazza per la Lega a Lodi! PD? Non pervenuto...
#questadomenica #CasanovaSindacoAnche a Lissone, in Brianza, il #25giugno si vota per mandare a casa il PD!Io e tutta questa bella gente vi salutiamo da Verona, domenica tutti a votare per #SboarinaSindaco!Alle 3 del pomeriggio di domenica con 40 gradi all'ombra ad Abano Terme (Padova) ma la Lega non si ferma!Alla faccia di Renzi, Gentiloni e Boldrini, #NOIUSSOLI! #25giugno #PDacasaE dopo un caldo comizio a Desenzano, trovi un bel gruppo pronto per un caldissimo addio al celibato: VIVA LO SPOSO!!!
Che auguri facciamo al ragazzo???Castiglione delle Stiviere (Mantova): il caldo non ci ferma!Splendida mattinata al mercato di Genova, dai che si cambia!!! PD a casa, #BucciSindaco!
E sarò tra poco sul lago di Garda e questa sera al mare in Veneto: alle 15 a Castiglione delle Stiviere (Parco Desenzani), alle 16.30 a Desenzano (Piazza Cappelletti) e dalle 19 fino a tarda sera a Jesolo! 
Aspetto anche TE!Focaccia al formaggio di Recco!
Buona serata Amici, vi voglio bene.
A voi, un po' meno alla Boldrini.Con i volontari della Misericordia di Genova. Grazie a chi regala il suo tempo per salvare delle vite!Un intreccio perverso che ci impone una "vita a rate", da indebitati, schiavi delle banche e della finanza, non più persone ma numeri, senza lavoro, senza diritti, senza dignità. Lo descrive bene Gianluigi Paragone nel suo ultimo libro "Gang Bank", che vi consiglio. 
Non è questa l'Italia che ho in mente, noi ai diktat del "ce lo chiede l'Europa" diremo di no.Qui Genova, nessun barcone in vista...
Fra 2 minuti ne parlo alla Zanzara, su Radio24.
Vi saluto Parenzo!Acciughe fritte a Genova, il caldo non mi ferma!
Fra poco sono in diretta sulla Pagina Fb di Radio Babboleo di Genova.Grazie anche alla bellissima piazza di Como! #25giugno #LandriscinaSindacoQualche ora fa, la calma del lago. Che fate Amici?Busta con due proiettili alla sede della Lega di Varese.
Si firmano "Lotta continua" e delirano "Lega infame, per te ci sono le lame", inneggiando a un "mondo meticcio e senza frontiere".
Ci fanno paura?
No! Ci fanno pena, anzi ci fanno ridere!
#forzalega #stopinvasione #25giugnoVERGOGNOSO!!!
Con 3 milioni di italiani poveri e 3 milioni di italiani disoccupati, il PD pensa a REGALARE la cittadinanza agli immigrati! LEGA, unica speranza! #noiussoli #lacittadinanzanonsiregalaDonare #sangue salva una vita e fa bene anche a chi dona: e tu, sei pronto a farlo?
#donazionesangueGrazie! Ma non è finita.
Domenica 25 giugno cambiare si può!
Tu voti?!?Si vola a Strasburgo, aereo ultimo modello...
Ciao amici!Voglia di montagna e di funghi, odio il caldo!Moderati con Davide Van de Sfroos a San Siro!Qui Genova, piazza spettacolare!!!
#votaLega #BucciSindacoCoi pescatori del Porto di Genova, prigionieri di centinaia di immigrati che bivaccano sulle banchine e a volte perfino sulle barche.Piazza piena per la Lega anche a Thiene (Vicenza).
P.s. E grandi Nicola e Irene con un bel libro appena acquistato in mano!A Sarego (Vicenza) per Nadia sindaco!
E buone le ciliegie vicentine! Difendiamo la nostra agricoltura, altro che le schifezze che l'Europa ci porta in tavola da chissà dove! #questadomenica #votalegaA Santa Maria di Sala (Venezia) anche il cappuccino ha le idee chiare!Buona giornata da me, Fabio e Sasha!Notte serena da Belluno, io e Mauro Corona vi vogliamo bene!Non uno, ma due arcobaleni a Feltre (Belluno) a sostegno dei candidati della Lega.
Dite che è un buon segno???A Jesolo, col Presidente Zaia!Ora a Jesolo, in provincia di Venezia, con Luca Zaia e tanta gente onesta e libera che non si arrende!Azzano Decimo, nello splendido Friuli, per sostenere i candidati della Lega e mandare a casa il PD.
Vi piace?Grazie Gorizia!
E ora ad Azzano Decimo, alle 13 a Prata di Pordenone, alle 14.30 a Godega di Sant'Urbano (Treviso), alle 16 a Jesolo (Venezia), alle 18.30 a Feltre e alle 20.30 a Belluno! 
Tanti non sanno che domenica si vota in oltre 1.000 comuni, dammi una mano. Passaparola!Umbria, che spettacolo Todi!Adoro gli immigrati che rispettano le regole!Tolentino (Marche) in piazza con la Lega: prima di pensare ai clandestini, il governo ridia una casa ai nostri TERREMOTATI!
P.s. Buona vita, piccola Arya!Stupendo il piccolino!!! Buona vita.Martedì mattina, piazza piena a Porto San Giorgio nelle Marche!
Con la Lega, soli contro il vecchio sistema.
P.s. Salutano tutti la Boldrini...203esimo anniversario dell'Arma dei Carabinieri.
Ieri, oggi e domani: noi stiamo con CHI CI DIFENDE!Guardate che barca di pescatori a Comacchio!Anche oggi si ascoltano gli italiani: piazza piena a Comacchio (Ferrara), con tanta gente che vuole vivere tranquilla e mandare a casa il PD.Coppa e salame piacentini, buoni!!!!!
Se mi vede la Brambilla...
Voi che fate?Anche lei, per un futuro sereno, già sorride alla Lega!
Spettacolo.Con don Umberto nella Chiesa dello Spirito Santo di Pistoia, che custodisce uno splendido organo fiammingo del '600.
Quanti tesori abbiamo in Italia, dobbiamo valorizzarli di più!
E voi, come state passando questa giornata?Lido di Camaiore, nella splendida Versilia.
Anche qui l'11 giugno si manda a casa il PD!Che inno alla vita, auguri ragazze!Al mercato di Monza, spettacolo! Tanta gente che ha voglia di cambiare.
Anche tu puoi dare una mano, con il tuo voto! #11giugnoFra poco in diretta su Canale5. #Mattino5Pienone anche a Borgomanero (NO) e Omegna (VCO)!A Omegna con tanta gente e con Paolo Marchioni, candidato sindaco della Lega. #11giugnoGRANDE NOTIZIA!
Nessun licenziamento per i dipendenti dei call center Wind Tre! Lo ha annunciato poco fa l'azienda, con i cui vertici ci eravamo sentiti proprio 2 giorni fa. Proprio ieri sera avevo incontrato una delegazione dei lavoratori della sede di Genova, a rischio insieme ai call center di Palermo, Roma e Cagliari.
Speriamo di aver dato il nostro piccolo contributo.
Lega sempre a difesa del lavoro!‪Chivasso (TO)! Avanti, chi si ferma è perduto!‬Ecco la squadra di Caselle Torinese!
#11Giugno #FaveroSindacoGuardate quanta bella gente con la Lega anche a Savigliano (Cuneo). Cambiare si può!Tanto affetto anche a Savigliano, Cuneo. Questi sono i nostri sondaggi migliori!Con la squadra della Lega candidata in comune a Cuneo!
Dai, insieme vincere si può!
#11giugno‪Visita lampo a Roata Canale, frazione di Cuneo dove i cittadini si sono opposti all'arrivo di decine di presunti profughi. #11giugno‬Oggi giornata ricca di incontri, si parte con Mondovì (Cuneo)..Caffè in ghiaccio e latte di mandorla, buona giornata!Piazza incredibile a Santeramo (Bari).
Dai che si vince, Renzi a casa!!!Quel Cielo di #Lombardia, così bello quand'è bello, così splendido, così in pace.
Buona festa Terra Mia!Splendida giornata salentina e pugliese! Qui Martina Franca, tra poco a Santeramo in Colle (Bari). Io non mi fermo!Qua a Martina Franca (Taranto): piazza pena!!!!!!Preparando la focaccia al formaggio di Recco con Biagio.
Buona settimana Amici, dalle 8 sarò su RTL 102.5, chi vuole mandare consigli o domande può farlo al 3493491025.Dedicato a voi.
Dedicato a chi sogna e non si arrende.A Genova con Marco Bucci e la grande squadra della Lega. Città splendida che sta soffrendo molto, soprattutto nelle periferie. Dopo 40 anni di sinistra qui si può VINCERE, e restituiremo a Zena il suo ruolo di grande capitale!
L'11 giugno #votaLega #BucciSindacoA Palermo per #IsmaeleSindaco!
Le buone idee della Lega vanno ovunque, da Nord a Sud!Prosegue il tour in terra bergamasca. Qua Villongo (BG), spettacolo!Un abbraccio ed un "in bocca al lupo" anche agli amici di Albano Sant'Alessandro (BG)!A Curno (Bergamo) anche Zeus sceglie la Lega!Brembate di Sopra (Bergamo) governata dalla Lega da 25 anni: scuole, sicurezza, parchi, campi sportivi, una casa di riposo eccezionale e perfino un osservatorio astronomico con 50mila visitatori.
Squadra che vince non si cambia!Bellissima mattinata al mercato di Tradate (Varese) per Dario Galli sindaco! L'11 giugno, nel tuo comune, ogni voto alla Lega e a Noi con Salvini è un voto per mandare a casa il Pd, anche a livello nazionale.
#votosubitoCisano Bergamasco, sindaco Lega e squadra al completo!Il saluto degli operai oggi a L'Aquila per me vale tantissimo!Ieri sera, insieme agli amici leghisti-camperisti di Grezzana (Verona) mangiando pasta al ragù, formaggio di monte e vino bianco delle colline veronesi.
Buona giornata Amici, io non mi fermo: alle 9.30 sarò al mercato di Senago e alle 11 al mercato di Lissone.
Per il PD vengono prima gli immigrati, per me vengono prima gli italiani.Spettacolo!!! #CongressoLegaRiordinando le ultime idee prima del mio intervento a #CongressoLega, Amici. È sempre un'emozione.‪Qui Parma, Amici! Dalle 11.30 potrete seguire la diretta anche sulla mia pagina Facebook. #CongressoLega‬Stasera a casa Salvini cotolette di tacchino, insalata e ciliegie, tutti prodotti italiani.
E per il papà, un bicchiere (forse due) di buon rosso della Valtellina.
E voi amici che fate?Buona giornata Amici, guardate che coppia!SE NE FREGANO dei 35 milioni di disoccupati, pensano solo a banchieri e immigrati! Questa è l'Europa, io glielo ho detto in faccia.
P.s. 2 MINUTI di verità che tivù e giornali nasconderanno aiutaci a farli girare sulle bacheche dei tuoi AMICI!

L'intervento integrale è sulla mia pagina Facebook.Questa #mattina all'#alba.
Buona giornata, #Amici.
#strasburgo #strasbourg#Bella la mia #sorellina che si #sposa: buona vita!!! #weddingday #weddingI miei due grandi tesori, mano nella mano.Stasera tortellini per i bambini!!!
Vi abbraccio, voi che fate?Ahimè niente cornetto alla crema, solo frutta...
Buon venerdì Amici!Grazie a questi primi Amici che questa domenica mi confermeranno la loro fiducia!
Se anche tu sei tra le migliaia di militanti leghisti con diritto di voto e vuoi che continui a fare il segretario, domenica, dalle 9 alle 18, vai a votare nella tua sede! #DomenicaVotaSalvini #DomenicaVotoSalviniTrofie al pesto e ravioli alla salsa di noci.
Buoni!!! E voi?
P.s. Che fa la Juve?On the road direzione Milano (mi sono fermato) ascoltando Vasco a palla!Povero #Milan, si ride per non piangere...
Ma che squadra abbiamo??? #milanromaRiguardo il capolavoro artistico della mia bimba, e sono felice!Prima a Gussago (Brescia) con la Lega per Stefano Quarena sindaco! Il brutto tempo non ci ferma, e vi salutiamo con tanti sorrisi!Qualche ora fa a Monza, con il candidato sindaco sostenuto dalla Lega Dario Allevi! Dai che si vince!Prime ciliegie, ovviamente italiane, dell'estate!
Buona serata Amici, vi voglio bene.Per il Pd un cittadino può difendersi solo se è aggredito... di notte. 
Di giorno e di pomeriggio? TUTTO LECITO!
Orgoglioso di aver gridato "VERGOGNA!" a questo governo che arma i DELINQUENTI e non difende i cittadini!  #legittimadifesasempre
